{
  "$schema": "http://json-schema.org/draft-07/schema#",
  "$id": "/Users/akihito/git/BEAR.Resource/docs/schema/semantic-log.json",
  "title": "BEAR.Resource Semantic Log",
  "description": "Complete semantic log structure for BEAR.Resource framework execution tracing",
  "links": [
    {
      "rel": "https://bearsunday.github.io/BEAR.Resource/docs/link-relations#ai-docs",
      "title": "BEAR.Resource Framework Overview for AI",
      "href": "/Users/akihito/git/BEAR.Resource/docs/llms.txt"
    },
    {
      "rel": "service-doc",
      "title": "BEAR.Resource Complete Documentation",
      "href": "/Users/akihito/git/BEAR.Resource/docs/llms-full.txt"
    },
    {
      "rel": "about",
      "title": "BEAR.Resource Project",
      "href": "https://bearsunday.github.io/BEAR.Resource/"
    }
  ],
  "type": "object",
  "properties": {
    "schemaUrl": {
      "type": "string",
      "description": "URL of the semantic log schema"
    },
    "open": {
      "description": "Resource request initiation context",
      "$ref": "/Users/akihito/git/BEAR.Resource/docs/schema/open-context.json"
    },
    "close": {
      "description": "Resource request completion context", 
      "$ref": "/Users/akihito/git/BEAR.Resource/docs/schema/complete-context.json"
    },
    "error": {
      "description": "Resource request error context",
      "$ref": "/Users/akihito/git/BEAR.Resource/docs/schema/error-context.json"
    },
    "events": {
      "type": "array",
      "description": "Array of events that occurred during execution"
    },
    "links": {
      "type": "array", 
      "description": "Array of hypermedia links related to this execution"
    }
  },
  "required": ["schemaUrl"],
  "additionalProperties": true
}