{
    "schemaUrl": "https://koriym.github.io/Koriym.SemanticLogger/schemas/semantic-log.json",
    "open": {
        "id": "bear_resource_request_1",
        "type": "bear_resource_request",
        "$schema": "https://bearsunday.github.io/BEAR.Resource/schemas/open-context.json",
        "context": {
            "method": "GET",
            "uri": "app://self/user/list?page=1"
        }
    },
    "events": [
        {
            "id": "db_query_1",
            "type": "database_query",
            "timestamp": "2025-01-01T10:00:00.100Z",
            "context": {
                "query": "SELECT * FROM users WHERE active = 1",
                "duration_ms": 15.2,
                "rows_returned": 100
            }
        },
        {
            "id": "db_query_2",
            "type": "database_query",
            "timestamp": "2025-01-01T10:00:00.120Z",
            "context": {
                "query": "SELECT * FROM profiles WHERE user_id = 1",
                "duration_ms": 8.5,
                "rows_returned": 1
            }
        },
        {
            "id": "db_query_3",
            "type": "database_query",
            "timestamp": "2025-01-01T10:00:00.135Z",
            "context": {
                "query": "SELECT * FROM profiles WHERE user_id = 2",
                "duration_ms": 8.3,
                "rows_returned": 1
            }
        },
        {
            "id": "db_query_100",
            "type": "database_query",
            "timestamp": "2025-01-01T10:00:01.200Z",
            "context": {
                "query": "SELECT * FROM profiles WHERE user_id = 100",
                "duration_ms": 12.1,
                "rows_returned": 1
            }
        },
        {
            "id": "cache_miss_1",
            "type": "cache_operation",
            "timestamp": "2025-01-01T10:00:01.250Z",
            "context": {
                "operation": "get",
                "key": "user_permissions_1",
                "result": "miss",
                "duration_ms": 2.1
            }
        },
        {
            "id": "external_api_1",
            "type": "http_request",
            "timestamp": "2025-01-01T10:00:01.300Z",
            "context": {
                "url": "https://api.example.com/permissions/1",
                "method": "GET",
                "status_code": 200,
                "duration_ms": 450.5
            }
        }
    ],
    "close": {
        "id": "bear_resource_complete_1",
        "type": "bear_resource_complete",
        "$schema": "https://bearsunday.github.io/BEAR.Resource/schemas/complete-context.json",
        "context": {
            "uri": "app://self/user/list?page=1",
            "code": 200,
            "headers": {
                "Content-Type": "application/json"
            },
            "body": {
                "users": "... (100 users with profiles)",
                "total": 100,
                "page": 1
            },
            "view": "{\"users\":[...],\"total\":100,\"page\":1}",
            "xhprofFile": "/tmp/xhprof_app___self_user_list_page=1_demo123.xhprof",
            "xdebugTraceFile": "/tmp/xdebug_trace_demo123.xt.gz",
            "total_duration_ms": 1250.8,
            "memory_peak_mb": 45.2
        },
        "openId": "bear_resource_request_1"
    },
    "links": []
}